{
  "schemaVersion": "1.0.0",
  "campaignId": "pre-rentree-2026",
  "decision": "PENDING",
  "reviewManifestSha256": "914e93bf7ed19cf743d33bd8724068dfb59c72f421b4e200c7363c7e0be51caa",
  "repoSha": "a1192c8dccf8eaa6ae223265a3bc9ceb56a6fff0",
  "snapshotSha256": "891f5b330b428bab783902e72c0186909f49c99a0836458609afcdd22754fef4",
  "generatorSha256": "b9a5bb30d172b756f2b567f9666e41223ceb51987c355c83cb39c81b5e507fc0",
  "reviewedBy": null,
  "reviewerRole": null,
  "decidedAt": null,
  "decisionReference": null,
  "findings": []
}
